{
  "schema_version": 1,
  "description": "Feasible mounting and support hardware for the pipe, duct and device sizes found in the Zenodo DuplexModel+MEP discipline models. Values are only those found in the cited sources. max_support_spacing is null on every product because none of the cited product pages publish a support spacing for that article; spacing lives in guidance.",
  "products": [
    {
      "id": "muepro-optimal-119866",
      "manufacturer": "Müpro",
      "product_line": "OPTIMAL",
      "name": "OPTIMAL Rohrschelle 13–15 mm, Anschlussgewinde M8/M10",
      "article_number": "119866",
      "element_types": ["pipe"],
      "role": "primary",
      "outer_diameter_mm": {"min": 13, "max": 15},
      "nominal_diameter_mm": null,
      "connection_threads": ["M8", "M10"],
      "load_rating": null,
      "max_support_spacing": null,
      "anchor": null,
      "assumptions": [],
      "notes": "Galvanised pipe clamp with DÄMMGULAST insert for indoor pipework, including drinking-water and heating pipe. The same page lists an M8-only article 119822 for the same 13–15 mm range. No load rating is printed in the article table.",
      "sources": [
        {
          "title": "Müpro OPTIMAL Rohrschelle article table",
          "url": "https://www.muepro.de/Produkte/Befestigungstechnik/Rohrschellen/OPTIMAL.html",
          "accessed": "2026-10-18"
        }
      ]
    },
    {
      "id": "muepro-optimal-119862",
      "manufacturer": "Müpro",
      "product_line": "OPTIMAL",
      "name": "OPTIMAL Rohrschelle 19–24 mm, Anschlussgewinde M8/M10",
      "article_number": "119862",
      "element_types": ["pipe"],
      "role": "primary",
      "outer_diameter_mm": {"min": 19, "max": 24},
      "nominal_diameter_mm": null,
      "connection_threads": ["M8", "M10"],
      "load_rating": null,
      "max_support_spacing": null,
      "anchor": null,
      "assumptions": [],
      "notes": "Same OPTIMAL table. M8-only article for this range is 119818. No load rating is printed in the article table.",
      "sources": [
        {
          "title": "Müpro OPTIMAL Rohrschelle article table",
          "url": "https://www.muepro.de/Produkte/Befestigungstechnik/Rohrschellen/OPTIMAL.html",
          "accessed": "2026-10-18"
        }
      ]
    },
    {
      "id": "muepro-optimal-119858",
      "manufacturer": "Müpro",
      "product_line": "OPTIMAL",
      "name": "OPTIMAL Rohrschelle 41–44 mm, Anschlussgewinde M8/M10",
      "article_number": "119858",
      "element_types": ["pipe"],
      "role": "primary",
      "outer_diameter_mm": {"min": 41, "max": 44},
      "nominal_diameter_mm": null,
      "connection_threads": ["M8", "M10"],
      "load_rating": null,
      "max_support_spacing": null,
      "anchor": null,
      "assumptions": [],
      "notes": "Same OPTIMAL table, listed there as the 1 1/4 in size. M8-only article for this range is 119814. No load rating is printed in the article table.",
      "sources": [
        {
          "title": "Müpro OPTIMAL Rohrschelle article table",
          "url": "https://www.muepro.de/Produkte/Befestigungstechnik/Rohrschellen/OPTIMAL.html",
          "accessed": "2026-10-18"
        }
      ]
    },
    {
      "id": "fischer-frs-l-539443",
      "manufacturer": "fischer",
      "product_line": "FRS-L Universal",
      "name": "Rohrschelle FRS-L Universal 8–11 mm",
      "article_number": "539443",
      "element_types": ["pipe"],
      "role": "primary",
      "outer_diameter_mm": {"min": 8, "max": 11},
      "nominal_diameter_mm": null,
      "connection_threads": ["M8", "M10"],
      "load_rating": {
        "value": 0.7,
        "unit": "kN",
        "kind": "max. recommended static load, centric tension"
      },
      "max_support_spacing": null,
      "anchor": null,
      "assumptions": [],
      "notes": "Two-screw clamp, galvanised, combo thread M8/M10. The 0.7 kN figure and clamping range are on the fischer international page (GTIN 4048962269550). Article number 539443 is taken from a reseller listing of FRS-L Universal 8–11. A reseller also prints Zulässige Nutzlast 980 N; that second figure is not used.",
      "sources": [
        {
          "title": "fischer Pipe clamp FRS-L Universal",
          "url": "https://www.fischer-international.com/en/products/installation-systems/pipe-clamps/two-screw-pipe-clamps/pipe-clamp-frs-l-universal",
          "accessed": "2026-10-18"
        },
        {
          "title": "Reseller listing FISCHER 539443 FRS-L Universal 8-11",
          "url": "https://www.unielektro.de/FISCHER-539443-FRS-L-Universal-8-11-Rohrschelle--item-01253925",
          "accessed": "2026-10-18"
        }
      ]
    },
    {
      "id": "fischer-frs-plus-079440",
      "manufacturer": "fischer",
      "product_line": "FRS Plus",
      "name": "Rohrschelle FRS Plus 12–15",
      "article_number": "079440",
      "element_types": ["pipe"],
      "role": "primary",
      "outer_diameter_mm": {"min": 12, "max": 15},
      "nominal_diameter_mm": null,
      "connection_threads": ["M8", "M10"],
      "load_rating": {
        "value": 0.8,
        "unit": "kN",
        "kind": "max. recommended static load, centric tension"
      },
      "max_support_spacing": null,
      "anchor": null,
      "assumptions": [],
      "notes": "Datasheet nominal size 1/4 in. Closing screw M5×20. For heating, sanitary and waste pipe on wall, ceiling and floor.",
      "sources": [
        {
          "title": "fischer datasheet Rohrschelle FRS Plus",
          "url": "https://www.meinhausshop.de/media/pdf/94_046_22--DBL-01-de.pdf",
          "accessed": "2026-10-18"
        }
      ]
    },
    {
      "id": "fischer-frs-plus-079441",
      "manufacturer": "fischer",
      "product_line": "FRS Plus",
      "name": "Rohrschelle FRS Plus 15–19",
      "article_number": "079441",
      "element_types": ["pipe"],
      "role": "primary",
      "outer_diameter_mm": {"min": 15, "max": 19},
      "nominal_diameter_mm": null,
      "connection_threads": ["M8", "M10"],
      "load_rating": {
        "value": 0.8,
        "unit": "kN",
        "kind": "max. recommended static load, centric tension"
      },
      "max_support_spacing": null,
      "anchor": null,
      "assumptions": [],
      "notes": "Datasheet nominal size 3/8 in. Closing screw M5×25.",
      "sources": [
        {
          "title": "fischer datasheet Rohrschelle FRS Plus",
          "url": "https://www.meinhausshop.de/media/pdf/94_046_22--DBL-01-de.pdf",
          "accessed": "2026-10-18"
        }
      ]
    },
    {
      "id": "fischer-frs-plus-079442",
      "manufacturer": "fischer",
      "product_line": "FRS Plus",
      "name": "Rohrschelle FRS Plus 20–24",
      "article_number": "079442",
      "element_types": ["pipe"],
      "role": "primary",
      "outer_diameter_mm": {"min": 20, "max": 24},
      "nominal_diameter_mm": null,
      "connection_threads": ["M8", "M10"],
      "load_rating": {
        "value": 0.8,
        "unit": "kN",
        "kind": "max. recommended static load, centric tension"
      },
      "max_support_spacing": null,
      "anchor": null,
      "assumptions": [],
      "notes": "Datasheet nominal size 1/2 in. Closing screw M5×25.",
      "sources": [
        {
          "title": "fischer datasheet Rohrschelle FRS Plus",
          "url": "https://www.meinhausshop.de/media/pdf/94_046_22--DBL-01-de.pdf",
          "accessed": "2026-10-18"
        }
      ]
    },
    {
      "id": "fischer-frs-plus-079445",
      "manufacturer": "fischer",
      "product_line": "FRS Plus",
      "name": "Rohrschelle FRS Plus 40–45",
      "article_number": "079445",
      "element_types": ["pipe"],
      "role": "primary",
      "outer_diameter_mm": {"min": 40, "max": 45},
      "nominal_diameter_mm": null,
      "connection_threads": ["M8", "M10"],
      "load_rating": {
        "value": 1.0,
        "unit": "kN",
        "kind": "max. recommended static load, centric tension"
      },
      "max_support_spacing": null,
      "anchor": null,
      "assumptions": [],
      "notes": "Datasheet nominal size 1 1/4 in. Closing screw M5×30.",
      "sources": [
        {
          "title": "fischer datasheet Rohrschelle FRS Plus",
          "url": "https://www.meinhausshop.de/media/pdf/94_046_22--DBL-01-de.pdf",
          "accessed": "2026-10-18"
        }
      ]
    },
    {
      "id": "fischer-frs-a2-064697",
      "manufacturer": "fischer",
      "product_line": "FRS A2",
      "name": "Rohrschelle FRS 4 in A2",
      "article_number": "064697",
      "element_types": ["pipe"],
      "role": "primary",
      "outer_diameter_mm": {"min": 102, "max": 116},
      "nominal_diameter_mm": null,
      "connection_threads": ["M10"],
      "load_rating": null,
      "max_support_spacing": null,
      "anchor": null,
      "assumptions": [],
      "notes": "Stainless A2 two-screw clamp. The cited table gives the clamping range and M10 connection thread and does not give a load for this row.",
      "sources": [
        {
          "title": "fischer datasheet Rohrschellen FRS A2/A4",
          "url": "https://www.meinhausshop.de/media/pdf/meinhausshop-frs-a2-de.pdf",
          "accessed": "2026-10-18"
        }
      ]
    },
    {
      "id": "hilti-mp-mi-20843",
      "manufacturer": "Hilti",
      "product_line": "MP-MI",
      "name": "MP-MI 3/8 in G heavy pipe clamp",
      "article_number": "20843",
      "element_types": ["pipe"],
      "role": "primary",
      "outer_diameter_mm": {"min": 15, "max": 19},
      "nominal_diameter_mm": null,
      "connection_threads": ["M10", "M12"],
      "load_rating": {
        "value": 1800,
        "unit": "N",
        "kind": "maximum load F, ambient, for the 15–64 mm band of MP-MI series G"
      },
      "max_support_spacing": null,
      "anchor": null,
      "assumptions": [],